<?xml version="1.0" encoding="UTF-8" ?>


<!ELEMENT master           			(intervenant+,parcours,parcours)>

<!ENTITY % lum "Luminy">
<!ENTITY % jer "St-Jerôme">
<!ENTITY % éto "étoile">

<!ENTITY  dom.univ    "univ-amu.fr" >
<!ENTITY  dom.dil     "dil.&dom.univ;" >



<!ELEMENT UE						(nomUE,ref-intervenant+,nbCreditsUE,résumé?, plan?, lieu_d_enseignement+)>
<!ATTLIST UE
    id ID #REQUIRED
    >
    
<!ELEMENT nomUE           			(#PCDATA)>
<!ELEMENT ref-intervenant			EMPTY    >
<!ATTLIST ref-intervenant
    ref IDREF #REQUIRED
    >
<!ELEMENT nbCreditsUE     			(#PCDATA)>
<!ELEMENT résumé        			(p)*>
<!ELEMENT plan          			(p)*>
<!ELEMENT lieu_d_enseignement    	(%lum;|%jer;|%éto;)>

<!ELEMENT p 						(#PCDATA|b|i|tt|p|ul|table|a)*>
<!ELEMENT ul				    	(p)+>
<!ELEMENT table						(tr)+>
<!ELEMENT tr						(td)+>
<!ELEMENT b							(#PCDATA)>
<!ELEMENT i							(#PCDATA)>
<!ELEMENT tt						(#PCDATA)>
<!ELEMENT a					    	(#PCDATA)>

<!ELEMENT intervenant				(nomIntervenant,mail,siteWeb?)>
<!ATTLIST intervenant
    id ID #REQUIRED
    >
    
<!ELEMENT nomIntervenant           	(#PCDATA)>
<!ELEMENT mail          			(#PCDATA)>
<!ELEMENT siteWeb        			(#PCDATA)>

<!ELEMENT semestre					(bloc-UE+)>

<!ELEMENT bloc-UE                   (nbCreditsBloc,UE+)>
<!ATTLIST bloc-UE
    rôle (Obligatoire|Facultatif) #REQUIRED
    >
<!ELEMENT nbCreditsBloc         	(#PCDATA)>


<!ELEMENT parcours                  (reponsable, nomParcours, description, débouché*,semestre,semestre)>
<!ELEMENT reponsable                (#PCDATA)>
<!ELEMENT nomParcours               (#PCDATA)>
<!ELEMENT description               (p)*>
<!ELEMENT débouché	                (p)*>

